{
	"contract_version": "policy-check-v1",
	"status": "fail",
	"repository": "acme/checkout",
	"policies_evaluated": [
		"fail_on_contradicted_critical",
		"fail_on_invalidated_adr",
		"min_trust_for_type.architecture_decision",
		"block_on_poisoned_referenced"
	],
	"summary": { "violations": 3, "policies_failed": 3 },
	"violations": [
		{
			"policy": "fail_on_contradicted_critical",
			"severity": "error",
			"entry_id": "11111111-1111-1111-1111-111111111111",
			"entry_type": "domain_rule",
			"entry_title": "Total must include tax",
			"trust_status": "validated",
			"trust_score": 0.72,
			"message": "Critical entry has an unresolved contradiction (trust 0.72)."
		},
		{
			"policy": "fail_on_invalidated_adr",
			"severity": "error",
			"entry_id": "22222222-2222-2222-2222-222222222222",
			"entry_type": "architecture_decision",
			"entry_title": "Use event sourcing for orders",
			"trust_status": "invalidated",
			"trust_score": 0.4,
			"message": "Architecture decision is invalidated — promote a superseding entry or re-validate."
		},
		{
			"policy": "block_on_poisoned_referenced",
			"severity": "error",
			"entry_id": "33333333-3333-3333-3333-333333333333",
			"entry_type": "coding_convention",
			"entry_title": "Use Date.now() for invoice dates",
			"trust_status": "poisoned",
			"trust_score": 0.1,
			"message": "Poisoned entry still present — rollback callers or archive the entry."
		}
	]
}
